House,Character,Dialogue
Ravenclaw,Professor Lockhart," What are you talking about, Harry? I think we’re getting a bit a- drowsy. And, Great Scott- no wonder! Look at the time! We’ve been here nearly four hours! Spooky how the time flies when one’s having fun. Heh, heh."
Ravenclaw,Professor Lockhart," Ah, thought so. So unlucky I wasn’t there. I know exactly the counter curse that could have spared her."
Ravenclaw,Professor Lockhart," I’m afraid that’s my doing, Severus. You see, Harry was helping me answer my fan mail."
Ravenclaw,Professor Lockhart," Not to worry, Harry. I will fix that arm of yours straight away."
Ravenclaw,Professor Lockhart," Oh, poor boy doesn’t know what he’s saying. Now, this… won’t hurt a bit. Brackium emendo!"
Ravenclaw,Professor Lockhart," Ah, yes, well, ha, that can sometimes happen, um, butuh, the point is, uh,…"
Ravenclaw,Professor Lockhart," …you can no longer feel any pain, and, heh- very clearly, the bones are not broken."
Ravenclaw,Professor Lockhart," Much more flexible, though."
Ravenclaw,Professor Lockhart," Gather ‘round, gather ‘round! Can everybody see me? Can you all hear me? Excellent! In light of the dark events of recent weeks, Professor Dumbledore has granted me permission to start this little Dueling Club to train you all up in case you ever need to defend yourselves, as I myself have done on countless occasions- for full details, see my published works. Let me introduce my assistant, Professor Snape. He has sportingly agreed to help me with a short demonstration. Now, I don’t want any of you youngsters to worry- you’ll still have your Potions master when I’m through with him, never fear. One, two, three."
Ravenclaw,Professor Lockhart, Whoaah!
Ravenclaw,Professor Lockhart," An excellent idea to show them that, Professor Snape, but if you don’t mind me saying, it was pretty obvious- ah- what you were about to do. And if I had wanted to stop you, it would have been only too easy."
Ravenclaw,Professor Lockhart," An excellent suggestion, Professor Snape! Ah… Let’s have a volunteer pair! Um, Potter, Weasley, how about you?"
Ravenclaw,Professor Lockhart," Good luck, Potter."
Ravenclaw,Professor Lockhart, Wands at the ready.
Ravenclaw,Professor Lockhart," On the count of three, cast your charms to disarm your opponent- only to disarm. We don’t want any accidents here. One, two--"
Ravenclaw,Professor Lockhart," Allow me, Professor Snape. Alarte ascendare!"
Ravenclaw,Professor Lockhart, So sorry- dozed off- what have I missed?
Ravenclaw,Professor Lockhart, My m-moment?
Ravenclaw,Professor Lockhart," Very well- ah- I’ll just be in my office getting, umgetting ready."
Ravenclaw,Professor Lockhart," Uh, ah- well, yes- um, urgent call- unavoidable- got to go."
Ravenclaw,Professor Lockhart," Well, um- as to that, most unfortunate. No one regrets more than I."
Ravenclaw,Professor Lockhart, Well- I must say- when I took the job there was nothing in the job description about a…
Ravenclaw,Professor Lockhart, Books can be misleading!
Ravenclaw,Professor Lockhart," My dear boy, do use your common sense! My books wouldn’t have sold half as well if people didn’t think I’d done all those things! HARRY You’re a fraud! You’ve just been taking credit for what other wizards have done!"
Ravenclaw,Professor Lockhart," Yes, now you mention it. I’m rather gifted with Memory Charms. Otherwise, you see, all those wizards would have gone blabbing. And I’d never have sold another book. In fact, ah…I’m ah…going to have to do the same to you."
Ravenclaw,Professor Lockhart," Excellent, Harry. Haa! Good work! Well then, I’ll just be, ah… There’s no need for me to stay."
Ravenclaw,Professor Lockhart," Now, boys what good will it do?"
Ravenclaw,Professor Lockhart," Um…but…obviously, yes. Sure you don’t want to test it first? No! Aaaah! It’s really quite filthy down here."
Ravenclaw,Professor Lockhart, It looks like a… snake.
Ravenclaw,Professor Lockhart," The adventure ends here, boys. But don’t fret. The world will know our story. How I was too late to save the girl. How you two tragically lost your minds at the sight of her mangled body. So, you first, Mr. Potter. Say good-bye to your memories. Obliviate!"
Ravenclaw,Professor Lockhart, Uhh… Hello. Who are you?
Ravenclaw,Professor Lockhart," Really? And uh, who- who am I?"
Ravenclaw,Professor Lockhart," It’s an odd sort of place this, isn’t it? Do you live here?"
Ravenclaw,Professor Lockhart, Really? Well?
Ravenclaw,Professor Lockhart, Amazing! This is just like magic!
Gryffindor,Professor Mcgonagall," What are you talking about, Mr. Weasley?"
Gryffindor,Professor Mcgonagall," Not today, Mr. Weasley. But, I must impress on both of you the seriousness of what you have done. I will be writing to your families tonight, and you will both receive detention."
Gryffindor,Professor Mcgonagall," Could I have your attention, please? Right. Now, today, we will be transforming animals into water goblets. Like so. One, two, three, Vera verto. Now it’s your turn. Well, who would like to go first? Ah! Mr. Weasley. “One, two, three. Vera verto.”"
Gryffindor,Professor Mcgonagall," That wand needs replacing, Mr. Weasley. Yes, Miss Granger?"
Gryffindor,Professor Mcgonagall," Well, very well. Well, you all know, of course, that Hogwarts was founded over a thousand years ago by the four greatest witches and wizards of the age Godric Gryffindor, Helga Hufflepuff, Rowena Ravenclaw, and Salazar Slytherin. Now, three of the founders coexisted quite harmoniously. One did not."
Gryffindor,Professor Mcgonagall," Salazar Slytherin wished to be more selective about the students admitted to Hogwarts. He believed magical learning should be kept within all-magic families. In other words, “pure-bloods.” Unable to sway the others, he decided to leave the school. Now, according to legend, Slytherin had built a hidden chamber in this castle, known as the Chamber of Secrets. Though, shortly before departing, he sealed it until that time when his own true heir returned to the school. The heir alone would be able to open the Chamber and unleash the horror within, and by so doing purge the school of all those who, in Slytherin’s view, were unworthy to study magic."
Gryffindor,Professor Mcgonagall," Well, naturally, the school had been searched many times. No such chamber has been found."
Gryffindor,Professor Mcgonagall," Well, the Chamber is said to home to something that only the Heir of Slytherin can control. It is said to be the home of a monster."
Gryffindor,Professor Mcgonagall," I think- do ya know- I think he’s been Petrified, Madame Pomfrey. Look! Perhaps he managed to take a picture of his attacker… (Poof)"
Gryffindor,Professor Mcgonagall," What can this mean, Albus?"
Gryffindor,Professor Mcgonagall, What should I tell the staff.
Gryffindor,Professor Mcgonagall, Oh!
Gryffindor,Professor Mcgonagall," This is out of my hands, Potter."
Gryffindor,Professor Mcgonagall, Professor Dumbledore will be waiting for you. Sherbet lemon.
Gryffindor,Professor Mcgonagall, This match has been cancelled.
Gryffindor,Professor Mcgonagall," Silence, Wood. You and your teammates will go to Gryffindor Tower, now. Potter, you and I will find Mr. Weasley. There’s something the both of you have to see."
Gryffindor,Professor Mcgonagall," I warn you, this could be a wee bit of a shock."
Gryffindor,Professor Mcgonagall," She was found near the Library, along with this. Does it mean anything to either of you?"
Gryffindor,Professor Mcgonagall," Could I have your attention please? Because of recent events, these new rules will be put into effect immediately. “All students will return to their house common rooms by six o’clock every evening. All students will be escorted to each lesson by a teacher. No exceptions.” I should tell you this unless the culprit behind these attacks is caught, it is likely the school will be closed."
Gryffindor,Professor Mcgonagall," All students are to return to their house dormitories at once. All teachers to the second floor corridor, immediately."
Gryffindor,Professor Mcgonagall," As you can see, the Heir of Slytherin has left another message. Our worst fear has been realized. A student has been taken by the monster into the Chamber itself. The students must be sent home. I’m afraid this is the end of Hogwarts."
Gryffindor,Professor Mcgonagall," Well, that’s settled. We’ll leave you to deal with the monster, Gilderoy. Your skills, after all, are a legend."
Gryffindor,Professor Mcgonagall, Ginny Weasley.
Gryffindor,Professor Mcgonagall," Could I have your attention, please?"
Hufflepuff,Professor Sprout," Morning, everyone! Good morning, everyone!"
Hufflepuff,Professor Sprout," Welcome to Greenhouse Three, Second Years. Now, gather around, everyone. Today, we are going to repot Mandrakes. Who here can tell me the properties of the Mandrake root? Yes, Miss Granger."
Hufflepuff,Professor Sprout," Excellent! Ten points to Gryffindor! Now, as our Mandrakes are still only seedlings their cries won’t kill you yet. But they could knock you out for several hours, which is why I have given each of you a pair of earmuffs for auditory protection. So, could you please put them on, right away? Quickly! Flaps tight down, and watch me closely. You grasp your Mandrake firmly, you pull it sharply up out of the pot… All Aah! Ooh!"
Hufflepuff,Professor Sprout, Got it? And… now you dunk it down into the other pot and pour a little sprinkling of soil to keep him warm.
Hufflepuff,Professor Sprout," Uh, Longbottom’s been neglecting his earmuffs."
Hufflepuff,Professor Sprout," Yes, well, just leave him there. Right! On we go! Plenty of pots to go around. Grasp your Mandrake, and pull it up!"
Gryffindor,Ron," Rescuing you, of course. Now, come on. Get your trunk!…"
Gryffindor,Ron, You’d better stand back. Let’s go!
Gryffindor,Ron, Come on.
Gryffindor,Ron," Come on, Harry! Hurry up!"
Gryffindor,Ron, I’ve got you Harry!
Gryffindor,Ron, Drive!
Gryffindor,Ron, Do you think it’d be all right if we had some of this?
Gryffindor,Ron," It’s not much, but it’s home."
Gryffindor,Ron," They were starving him, Mum. There were bars on his window!"
Gryffindor,Ron, Ginny. She’s been talking about you all summer. A bit annoying really.
Gryffindor,Ron," Dad works in the Ministry of Magic, in the Misuse of Muggle Artifacts Office. Dad loves Muggles, thinks they’re fascinating."
Gryffindor,Ron, He’s always doing that.
Gryffindor,Ron," But Harry’s never traveled by Floo powder before, Mum."
Gryffindor,Ron, Diagon Alley!
Gryffindor,Ron, Mum fancies him.
Gryffindor,Ron, Whao!
Gryffindor,Ron, I don’t know. The gateway’s sealed its self for some reason.
Gryffindor,Ron," Harry, if we can’t get through, maybe Mum and Dad can’t get back!"
Gryffindor,Ron, The car…
Gryffindor,Ron," Uh, right. Okay."
Gryffindor,Ron, Oh no! The Invisibility Booster must be faulty!
Gryffindor,Ron, Okay.
Gryffindor,Ron, We can’t be far behind.
Gryffindor,Ron, We must be gettin’ close.
Gryffindor,Ron, Harry! Hold on! Take my hand! Hold on!
Gryffindor,Ron, Yeah.
Gryffindor,Ron, Welcome home.
Gryffindor,Ron, It’s not working! Ahhhh!
Gryffindor,Ron, Stop! Stop! Stop! Huh… Aahh!
Gryffindor,Ron, Ahh-ha-ha! My wand! Look at my wand!
Gryffindor,Ron, What’s happening?
Gryffindor,Ron, Ahh! Ahhhh! Ahh!
Gryffindor,Ron," Scabbers, you OK? The car! …Dad’s gonna kill me."
Gryffindor,Ron," Honestly, Professor Snape, I think it did more damage to us."
Gryffindor,Ron," We’ll go and get our stuff, then."
Gryffindor,Ron," You’re going to expel us, aren’t you?"
Gryffindor,Ron," Huhh… Say it, I’m doomed."
Gryffindor,Ron," Bloody bird’s a menace. Oh, no!"
Gryffindor,Ron, What do we do now?
Gryffindor,Ron, Uh-oh. I smell trouble.
Gryffindor,Ron, Those are Nimbus Two Thousand and Ones! How did you get those?
Gryffindor,Ron," You’ll pay for that one, Malfoy. Eat slugs!"
Gryffindor,Ron, (Blech…)
Gryffindor,Ron, (Blech…)
Gryffindor,Ron, (Blech…)
Gryffindor,Ron, (Blech…) It’s disgusting.
Gryffindor,Ron, Hear what?
Gryffindor,Ron, Kill?
Gryffindor,Ron, I don’t like spiders… What’s that?
Gryffindor,Ron, Are you mad?
Gryffindor,Ron, Ahem. Vera verto!
Gryffindor,Ron, Three guesses who.
Gryffindor,Ron, D’you think it’s true? D’you think there really is a Chamber of Secrets?
Gryffindor,Ron, Let’s think. Who do we know who thinks all Muggle-borns are scum?
Gryffindor,Ron," Of course. You heard him! ‘You’ll be next Mudbloods,’"
Gryffindor,Ron, Crabbe and Goyle must know. Maybe we could trick them into telling.
Gryffindor,Ron, Wicked! Malfoy’ll tell us anything.
Gryffindor,Ron, I’ll stop it.
Gryffindor,Ron," Enlighten me. Why are we brewing this potion in broad daylight, in the middle of a girl’s lavatory? Don’t you think we’ll get caught?"
Gryffindor,Ron, Why?
Gryffindor,Ron, Who?
Gryffindor,Ron, Who’s Moaning Myrtle?
Gryffindor,Ron, Who cares?
Gryffindor,Ron, You’re a Parselmouth? Why didn’t you tell us?
Gryffindor,Ron," Oh, that’s what you said to it!"
Gryffindor,Ron, I heard you speaking Parseltongue. Snake language?
Gryffindor,Ron," Exactly! Now the whole school’s gonna think you’re his great- greatgreat grandson, or something."
Gryffindor,Ron, How?
Gryffindor,Ron, Whose hair are you ripping out then?
Gryffindor,Ron, Ahem…
Gryffindor,Ron, Yeah. Right.
Gryffindor,Ron, How thick could you get?
Gryffindor,Ron, Ugh- essence of Crabbe.
Gryffindor,Ron, I think I’m gonna be sick!
Gryffindor,Ron, That was close!
Gryffindor,Ron, Look at your tail!
Gryffindor,Ron, Have you spoken to Hermione?
Gryffindor,Ron, Yuck!
Gryffindor,Ron," But, it can’t hurt if someone throws something at you. I mean, it’ll just go right through you."
Gryffindor,Ron," We don’t even know this Tom Riddle. He sounds like a dirty, rotten snitch to me."
Gryffindor,Ron," That’ll be a cheerful visit! “Hello, Hagrid! Tell us, have you been setting anything mad and hairy loose in the castle lately?”"
Gryffindor,Ron," Who ever it was, they must have been looking for something."
Gryffindor,Ron, Hermione!
Gryffindor,Ron, But you heard McGonagall! We’re not allowed to leave the tower except for class.
Gryffindor,Ron," That’s Dad’s boss! Cornelius Fudge, Minister of Magic!"
Gryffindor,Ron," Hagrid’s right! With Dumbledore gone, there’ll be an attack a day!"
Gryffindor,Ron, What?!
Gryffindor,Ron, They’re headed to the Dark Forest! Why spiders! Why couldn’t it be “follow the butterflies?”
Gryffindor,Ron," Harry, I don’t like this… Harry, I don’t like this at all!"
Gryffindor,Ron, Can we go back now?
Gryffindor,Ron, Harry.
Gryffindor,Ron, Harry!
Gryffindor,Ron, Ahh- hhh…
Gryffindor,Ron, Can we panic now?
Gryffindor,Ron, Know any spells?
Gryffindor,Ron, Where’s Hermione when you need her?
Gryffindor,Ron, Glad we’re out of there! Ah- Aaaah!
Gryffindor,Ron, Thanks for that.
Gryffindor,Ron, The flying gear’s jammed!
Gryffindor,Ron, I’m trying!
Gryffindor,Ron," Follow the spiders! Follow the spiders! If Hagrid ever gets out of Azkaban, I’ll kill him! I mean, what was the point of sending us in there? What have we found out?"
Gryffindor,Ron, What’s that?
Gryffindor,Ron," But if it kills by looking people in the eye, why is it no one’s dead?"
Gryffindor,Ron," And Mrs. Norris? I’m pretty sure she didn’t have a camera or a mirror, Harry."
Gryffindor,Ron, But how’s a basilisk been getting around? A dirty great snake- someone would have seen it.
Gryffindor,Ron, Pipes? It’s using the plumbing!
Gryffindor,Ron, Moaning Myrtle.
Gryffindor,Ron, ‘Her skeleton will lie in the chamber forever.’ Ginny…
Gryffindor,Ron, What about my sister?!
Gryffindor,Ron, You’re the Defense Against the Dark Arts teacher! You can’t go now!
Gryffindor,Ron, Is there anything you can do?
Gryffindor,Ron," Say something. Harry, say something in Parseltongue!"
Gryffindor,Ron, Better you than us.
Gryffindor,Ron, Ugh!
Gryffindor,Ron, Go on.
Gryffindor,Ron, What’s this?
Gryffindor,Ron," Bloody hell. Whatever shed this must be sixty feet long-- or more! Heart of a lion, this one."
Gryffindor,Ron, Harry! Harry!
Gryffindor,Ron, I’m fine!
Gryffindor,Ron, Um…Ron Weasley.
Gryffindor,Ron, Lockhart’s memory charm backfired. He hasn’t got a clue who he is!
Gryffindor,Ron, No!
Gryffindor,Ron, What’ll do I do now?
Gryffindor,Ron, OK.
Gryffindor,Ron," Thanks, sir!"
Gryffindor,Ron," Uhh-um… Welcome back, Hermione."
Gryffindor,Ron, Uh… Harry?
Gryffindor,Ron, Bloody hell!
Gryffindor,Ron, Uh… Bloody hell.
Gryffindor,Ron, But where’s Hermione?
Gryffindor,Ron, Okay.
Gryffindor,Ron," What are you doing d- uh, I mean… What are you doing down here?"
Gryffindor,Ron, Uhh…
Gryffindor,Ron, Ahem…Stomachache.
Gryffindor,Ron, S- scar.
Gryffindor,Seamus," No, ma’am, he’s just fainted."
Gryffindor,Seamus," Look, everyone! Weasley’s got himself a Howler!"
Gryffindor,Seamus, Cornish pixies?
Gryffindor,Seamus," Ha, ha. Ha, ha, ha…"
Gryffindor,Sir Nicholas," Hello, Percy. Miss Clearwater."
Gryffindor,Sir Nicholas, Thank you!
Gryffindor,Sir Nicholas, Good evening!
Gryffindor,Sir Nicholas, Thank you! Hello! Hermione! Welcome back!
Slytherin,Snape, You were seen by no less than seven Muggles. Do you have any idea how serious this is? You have risked the exposure of our world. Not to mention the damage you inflicted on a Whomping Willow that’s been on these grounds since before you were born.
Slytherin,Snape," Silence! I assure you, that were you in Slytherin, and your fate rested with me, the both of you would be on the train home- tonight. As it is…"
Slytherin,Snape," Headmaster, these boys have flouted the Decree for the Restriction of Underage Wizardry. As such--"
Slytherin,Snape," If I might, Headmaster? Perhaps Potter and his friends were simply in the wrong place at the wrong time. However, the circumstances are suspicious. I, for one, don’t recall seeing Potter at dinner."
Slytherin,Snape," Yes, Miss Granger?"
Slytherin,Snape, Expelliarmus!
Slytherin,Snape," Perhaps it would be prudent to first teach the students to block unfriendly spells, Professor."
Slytherin,Snape," Weasley’s wand causes devastation with the simplest spells. We’ll be sending Potter to the hospital wing in a matchbox. Might I suggest someone from my own house? Malfoy, perhaps?"
Slytherin,Snape," Don’t move, Potter. I’ll get rid of it for you."
Slytherin,Snape, Vipera evenesca.
Slytherin,Snape," A girl has been snatched by the monster, Lockhart. Your moment has come, at last."
Slytherin,Snape, Weren’t you saying just last night that you’ve known all along where the entrance to the Chamber of Secrets is?
Slytherin,Tom Riddle,(rearranges) I AM LORD VOLDEMORT!
Slytherin,Tom Riddle, Professor Dumbledore.
Slytherin,Tom Riddle," Yes, Professor. I- I suppose I- I had to see for myself if the rumors were true."
Slytherin,Tom Riddle," About the school, as well? I don’t have a home to go to. They wouldn’t really close Hogwarts, would they Professor?"
Slytherin,Tom Riddle, Sir- if it all stopped- if the person responsible was caught--
Slytherin,Tom Riddle," No, sir. Nothing."
Slytherin,Tom Riddle," Good night, sir."
Slytherin,Tom Riddle," Evening, Hagrid. I’m going to have to turn you in, Hagrid. I don’t think you meant it to kill anyone, but--"
Slytherin,Tom Riddle, The dead girl’s parents will be here tomorrow. The least Hogwarts can do is make sure the thing that killed their daughter is slaughtered.
Slytherin,Tom Riddle," Monsters don’t make good pets, Hagrid. Now, stand aside."
Slytherin,Tom Riddle," Stand aside, Hagrid!"
Slytherin,Tom Riddle, Cistem aperio! Arania exumai!
Slytherin,Tom Riddle," I can’t let you go. They’ll have your wand for this, Hagrid. You’ll be expelled."
Slytherin,Tom Riddle, She won’t wake.
Slytherin,Tom Riddle," She’s still alive, but only just."
Slytherin,Tom Riddle," A memory, preserved in a diary for fifty years."
Slytherin,Tom Riddle, It won’t come until it’s called.
Slytherin,Tom Riddle, You won’t be needing it.
Slytherin,Tom Riddle," I’m afraid I can’t do that, Harry. You see, as poor Ginny grows weaker, I grow stronger. Yes Harry, it was Ginny Weasley who opened the Chamber of Secrets."
Slytherin,Tom Riddle," It was Ginny who set the basilisk on the Mudbloods and Filch’s cat, Ginny who wrote the threatening messages on the walls."
Slytherin,Tom Riddle," Because I told her to. You’ll find that I can be very persuasive. Not that she knew what she was doing. She was, shall we say, in a kind of trance. Still, the power of the diary began to scare her. And she tried to dispose of it in the girl’s bathroom. And then, who should find it, but you? The very person I was most anxious to meet."
Slytherin,Tom Riddle," I knew I had to talk to you, meet you if I could. So I decided to show you my capture of that brainless oaf, Hagrid, to gain your trust."
Slytherin,Tom Riddle, It was my word against Hagrid’s. Only Dumbledore seemed to think he was innocent.
Slytherin,Tom Riddle," He certainly kept an annoyingly close watch on me after that. I knew it wouldn’t be safe to open the Chamber again while I was still at school, so I decided to leave behind a diary preserving my sixteen-year-old self in its pages, so that one day I would be able to lead another to finish Salazar Slytherin’s noble work."
Slytherin,Tom Riddle," Haven’t I told you? Killing Mudbloods doesn’t matter to me anymore. For many months now, my new target… has been you. How is it that a baby, with no extraordinary magical talent, was able to defeat the greatest wizard of all time? How did you escape with nothing but a scar, while Lord Voldemort’s powers were destroyed?"
Slytherin,Tom Riddle," Voldemort is my past, present, and future. (writes in the air)"
Slytherin,Tom Riddle," Surely, you didn’t think I was going to keep my filthy Muggle father’s name? No. I fashioned myself a new name, a name I knew wizards everywhere would one day fear to speak, when I became the greatest sorcerer in the world."
Slytherin,Tom Riddle, Dumbledore’s been driven out of this castle by the mere memory of me!
Slytherin,Tom Riddle," So, this is what Dumbledore sends his great defender, a songbird and an old hat. Shearhas- Samnathas- Sélithaeine."
Slytherin,Tom Riddle," Let’s match the power of Lord Voldemort, Heir of Salazar Slytherin, against the famous Harry Potter. Sethae- He- This. Parseltongue won’t save you now, Potter. It only obeys me!"
Slytherin,Tom Riddle," No! Your bird may have blinded the basilisk, but it can still hear you!"
Slytherin,Tom Riddle," Yes, Potter, the process is nearly complete. In a few minutes Ginny will be dead, and I will cease to be a memory. Lord Voldemort will return- very… much… alive!"
Slytherin,Tom Riddle," Remarkable isn’t it, how quickly the venom of the basilisk penetrates the body? I’d guess you have little more than a minute to live. You’ll be with your dear Mudblood mother soon, Harry. Funny, the damage a silly little book can do… especially in the hands of a silly, little girl. What are you doing? Stop! No! Ahhhh! Ahhhh! Ahhhh!"
No Entry,Uncle Vernon, Harry Potter!
No Entry,Uncle Vernon," I’m warning you, if you can’t control that bloody bird it’ll have to go."
No Entry,Uncle Vernon," Huh, huh! So you could send secret messages to you freaky little friends. No, sir!"
No Entry,Uncle Vernon," I should think you’d be a little more grateful. We’ve raised you since you were a baby, given you the food off our table, even let you have Dudley’s second bedroom, purely out of the goodness of our hearts."
No Entry,Uncle Vernon," Which should be any minute! Ahem…Now let’s go over our schedule once again, shall we? Petunia when the Masons arrive you will be…?"
No Entry,Uncle Vernon," Good! And- and Dudley, you will be…?"
No Entry,Uncle Vernon, Excellent! …And you…?
No Entry,Uncle Vernon," Too right, you will. With any luck, this could well be the day I make the biggest deal of my career. And you will not mess it up!"
No Entry,Uncle Vernon, Mr. and Mrs. Mason! Do come in!
No Entry,Uncle Vernon," Ohh, don’t mind that! It’s just the cat."
No Entry,Uncle Vernon, So when they arrive at the ninth hole…
No Entry,Uncle Vernon, What the devil are you doing up here?
No Entry,Uncle Vernon, You just ruined the punch line of my Japanese golfer joke!
No Entry,Uncle Vernon," One more sound, and you’ll wish you’d never been born, boy! And fix that door!"
No Entry,Uncle Vernon," …it spread as far as the eye could see, all over the floor of this vast building, and it was this deep. And one plumber said “Look at all that water.” A-and the second plumber said, “Yes, and that’s just the top of it!”"
No Entry,Uncle Vernon, I’m so sorry! It’s my nephew- he’s very disturbed. Meeting strangers upsets him. That’s why I kept him upstairs!
No Entry,Uncle Vernon, You’re never going back to that school. You’re never going to see those freaky friends of yours again. Never!
No Entry,Uncle Vernon," Now, what the hell’s he doing? Potter!"
No Entry,Uncle Vernon," Petunia, he’s escaping!"
No Entry,Uncle Vernon, Come here!
No Entry,Uncle Vernon," Oh no, boy! You and that bloody pigeon aren’t going anywhere!"
No Entry,Uncle Vernon, No! No! No! No! Aaaah!
No Entry,Uncle Vernon, Oh… Damn.
Gryffindor,Albus," Ah, Professor, I would trust Hagrid with my life."
